reading from file signaling.pcap, link-type EN10MB (Ethernet), snapshot length 262144
02:17:04.252995 IP 10.10.10.20.5062 > 10.10.10.10.5060: SIP: INVITE sip:800@lab.local SIP/2.0
02:17:04.253505 IP 10.10.10.10.5060 > 10.10.10.20.5062: SIP: SIP/2.0 100 trying -- your call is important to us
02:17:04.253553 IP 10.10.10.10.5060 > 10.10.10.41.5070: SIP: INVITE sip:+97145550123@localcred.sip.vapi.ai SIP/2.0
02:17:04.253764 IP 10.10.10.41.5070 > 10.10.10.10.5060: SIP: SIP/2.0 100 Trying
02:17:04.255012 IP 10.10.10.41.5070 > 10.10.10.10.5060: SIP: SIP/2.0 180 Ringing
02:17:04.255151 IP 10.10.10.10.5060 > 10.10.10.20.5062: SIP: SIP/2.0 180 Ringing
02:17:04.256130 IP 10.10.10.41.5070 > 10.10.10.10.5060: SIP: SIP/2.0 200 OK
02:17:04.256301 IP 10.10.10.10.5060 > 10.10.10.20.5062: SIP: SIP/2.0 200 OK
02:17:04.256318 IP 10.10.10.20.5062 > 10.10.10.10.5060: SIP: ACK sip:800@lab.local SIP/2.0
