reading from file signaling.pcap, link-type EN10MB (Ethernet), snapshot length 262144
02:17:29.637007 IP 10.10.10.20.5062 > 10.10.10.10.5060: SIP: INVITE sip:800@lab.local SIP/2.0
02:17:29.638800 IP 10.10.10.10.5060 > 10.10.10.20.5062: SIP: SIP/2.0 100 trying -- your call is important to us
02:17:29.638850 IP 10.10.10.10.5060 > 10.10.10.41.5070: SIP: INVITE sip:+97145550123@localcred.sip.vapi.ai SIP/2.0
02:17:29.638984 IP 10.10.10.41.5070 > 10.10.10.10.5060: SIP: SIP/2.0 100 Trying
02:17:29.640089 IP 10.10.10.41.5070 > 10.10.10.10.5060: SIP: SIP/2.0 180 Ringing
02:17:29.640232 IP 10.10.10.10.5060 > 10.10.10.20.5062: SIP: SIP/2.0 180 Ringing
02:17:29.641270 IP 10.10.10.41.5070 > 10.10.10.10.5060: SIP: SIP/2.0 200 OK
02:17:29.641769 IP 10.10.10.10.5060 > 10.10.10.20.5062: SIP: SIP/2.0 200 OK
02:17:29.641801 IP 10.10.10.20.5062 > 10.10.10.10.5060: SIP: ACK sip:800@lab.local SIP/2.0
