reading from file signaling.pcap, link-type EN10MB (Ethernet), snapshot length 262144
02:17:23.068995 IP 10.10.10.20.5062 > 10.10.10.10.5060: SIP: INVITE sip:800@lab.local SIP/2.0
02:17:23.069667 IP 10.10.10.10.5060 > 10.10.10.20.5062: SIP: SIP/2.0 100 trying -- your call is important to us
02:17:23.069748 IP 10.10.10.10.5060 > 10.10.10.41.5070: SIP: INVITE sip:+97145550123@localcred.sip.vapi.ai SIP/2.0
02:17:23.069884 IP 10.10.10.41.5070 > 10.10.10.10.5060: SIP: SIP/2.0 503 Service Unavailable
02:17:23.070021 IP 10.10.10.10.5060 > 10.10.10.41.5070: SIP: ACK sip:+97145550123@localcred.sip.vapi.ai SIP/2.0
02:17:23.070132 IP 10.10.10.10.5060 > 10.10.10.42.5080: SIP: INVITE sip:+97145550123@localcred.sip.vapi.ai SIP/2.0
02:17:23.070254 IP 10.10.10.42.5080 > 10.10.10.10.5060: SIP: SIP/2.0 100 Trying
02:17:23.071382 IP 10.10.10.42.5080 > 10.10.10.10.5060: SIP: SIP/2.0 180 Ringing
02:17:23.071534 IP 10.10.10.10.5060 > 10.10.10.20.5062: SIP: SIP/2.0 180 Ringing
02:17:23.072499 IP 10.10.10.42.5080 > 10.10.10.10.5060: SIP: SIP/2.0 200 OK
02:17:23.072643 IP 10.10.10.10.5060 > 10.10.10.20.5062: SIP: SIP/2.0 200 OK
02:17:23.072661 IP 10.10.10.20.5062 > 10.10.10.10.5060: SIP: ACK sip:800@lab.local SIP/2.0
