reading from file signaling.pcap, link-type EN10MB (Ethernet), snapshot length 262144
02:17:36.669034 IP 10.10.10.20.5062 > 10.10.10.10.5060: SIP: INVITE sip:800@lab.local SIP/2.0
02:17:36.670259 IP 10.10.10.10.5060 > 10.10.10.20.5062: SIP: SIP/2.0 100 trying -- your call is important to us
02:17:36.670365 IP 10.10.10.10.5060 > 10.10.10.41.5070: SIP: INVITE sip:+97145550123@localcred.sip.vapi.ai SIP/2.0
02:17:36.670511 IP 10.10.10.41.5070 > 10.10.10.10.5060: SIP: SIP/2.0 100 Trying
02:17:36.671799 IP 10.10.10.41.5070 > 10.10.10.10.5060: SIP: SIP/2.0 180 Ringing
02:17:36.671926 IP 10.10.10.10.5060 > 10.10.10.20.5062: SIP: SIP/2.0 180 Ringing
02:17:36.671942 IP 10.10.10.20.5062 > 10.10.10.10.5060: SIP: CANCEL sip:800@lab.local SIP/2.0
02:17:36.689472 IP 10.10.10.10.5060 > 10.10.10.20.5062: SIP: SIP/2.0 408 Request Timeout
02:17:36.689492 IP 10.10.10.10.5060 > 10.10.10.41.5070: SIP: CANCEL sip:+97145550123@localcred.sip.vapi.ai SIP/2.0
02:17:36.689505 IP 10.10.10.20.5062 > 10.10.10.10.5060: SIP: ACK sip:800@lab.local SIP/2.0
02:17:36.689577 IP 10.10.10.41.5070 > 10.10.10.10.5060: SIP: SIP/2.0 200 OK
02:17:36.690774 IP 10.10.10.41.5070 > 10.10.10.10.5060: SIP: SIP/2.0 487 Request Terminated
02:17:36.690877 IP 10.10.10.10.5060 > 10.10.10.41.5070: SIP: ACK sip:+97145550123@localcred.sip.vapi.ai SIP/2.0
