reading from file signaling.pcap, link-type EN10MB (Ethernet), snapshot length 262144
02:16:57.585082 IP 10.10.10.20.5062 > 10.10.10.10.5060: SIP: INVITE sip:800@lab.local SIP/2.0
02:16:57.587437 IP 10.10.10.10.5060 > 10.10.10.20.5062: SIP: SIP/2.0 100 trying -- your call is important to us
02:16:57.587640 IP 10.10.10.10.5060 > 10.10.10.42.5080: SIP: INVITE sip:+97145550123@localcred.sip.vapi.ai SIP/2.0
02:16:57.587822 IP 10.10.10.42.5080 > 10.10.10.10.5060: SIP: SIP/2.0 100 Trying
02:16:57.588983 IP 10.10.10.42.5080 > 10.10.10.10.5060: SIP: SIP/2.0 180 Ringing
02:16:57.589141 IP 10.10.10.10.5060 > 10.10.10.20.5062: SIP: SIP/2.0 180 Ringing
02:16:57.590086 IP 10.10.10.42.5080 > 10.10.10.10.5060: SIP: SIP/2.0 200 OK
02:16:57.590280 IP 10.10.10.10.5060 > 10.10.10.20.5062: SIP: SIP/2.0 200 OK
02:16:57.590301 IP 10.10.10.20.5062 > 10.10.10.10.5060: SIP: ACK sip:800@lab.local SIP/2.0
