reading from file signaling.pcap, link-type EN10MB (Ethernet), snapshot length 262144
02:17:15.257024 IP 10.10.10.20.5062 > 10.10.10.10.5060: SIP: INVITE sip:800@lab.local SIP/2.0
02:17:15.257776 IP 10.10.10.10.5060 > 10.10.10.20.5062: SIP: SIP/2.0 100 trying -- your call is important to us
02:17:15.257846 IP 10.10.10.10.5060 > 10.10.10.41.5070: SIP: INVITE sip:+97145550123@localcred.sip.vapi.ai SIP/2.0
02:17:15.258007 IP 10.10.10.41.5070 > 10.10.10.10.5060: SIP: SIP/2.0 100 Trying
02:17:15.259262 IP 10.10.10.41.5070 > 10.10.10.10.5060: SIP: SIP/2.0 180 Ringing
02:17:15.259683 IP 10.10.10.10.5060 > 10.10.10.20.5062: SIP: SIP/2.0 180 Ringing
02:17:15.260433 IP 10.10.10.41.5070 > 10.10.10.10.5060: SIP: SIP/2.0 200 OK
02:17:15.260541 IP 10.10.10.10.5060 > 10.10.10.20.5062: SIP: SIP/2.0 200 OK
02:17:15.260555 IP 10.10.10.20.5062 > 10.10.10.10.5060: SIP: ACK sip:800@lab.local SIP/2.0
02:17:15.277060 IP 10.10.10.20.5062 > 10.10.10.10.5060: SIP: INVITE sip:800@lab.local SIP/2.0
02:17:15.277284 IP 10.10.10.10.5060 > 10.10.10.20.5062: SIP: SIP/2.0 100 trying -- your call is important to us
02:17:15.277318 IP 10.10.10.10.5060 > 10.10.10.41.5070: SIP: INVITE sip:+97145550123@localcred.sip.vapi.ai SIP/2.0
02:17:15.277408 IP 10.10.10.41.5070 > 10.10.10.10.5060: SIP: SIP/2.0 100 Trying
02:17:15.278542 IP 10.10.10.41.5070 > 10.10.10.10.5060: SIP: SIP/2.0 180 Ringing
02:17:15.278649 IP 10.10.10.10.5060 > 10.10.10.20.5062: SIP: SIP/2.0 180 Ringing
02:17:15.279660 IP 10.10.10.41.5070 > 10.10.10.10.5060: SIP: SIP/2.0 200 OK
02:17:15.279769 IP 10.10.10.10.5060 > 10.10.10.20.5062: SIP: SIP/2.0 200 OK
02:17:15.279780 IP 10.10.10.20.5062 > 10.10.10.10.5060: SIP: ACK sip:800@lab.local SIP/2.0
02:17:15.296982 IP 10.10.10.20.5062 > 10.10.10.10.5060: SIP: INVITE sip:800@lab.local SIP/2.0
02:17:15.297325 IP 10.10.10.10.5060 > 10.10.10.20.5062: SIP: SIP/2.0 100 trying -- your call is important to us
02:17:15.297371 IP 10.10.10.10.5060 > 10.10.10.41.5070: SIP: INVITE sip:+97145550123@localcred.sip.vapi.ai SIP/2.0
02:17:15.297469 IP 10.10.10.41.5070 > 10.10.10.10.5060: SIP: SIP/2.0 100 Trying
02:17:15.298600 IP 10.10.10.41.5070 > 10.10.10.10.5060: SIP: SIP/2.0 180 Ringing
02:17:15.298717 IP 10.10.10.10.5060 > 10.10.10.20.5062: SIP: SIP/2.0 180 Ringing
02:17:15.299738 IP 10.10.10.41.5070 > 10.10.10.10.5060: SIP: SIP/2.0 200 OK
02:17:15.299899 IP 10.10.10.10.5060 > 10.10.10.20.5062: SIP: SIP/2.0 200 OK
02:17:15.299913 IP 10.10.10.20.5062 > 10.10.10.10.5060: SIP: ACK sip:800@lab.local SIP/2.0
02:17:15.316959 IP 10.10.10.20.5062 > 10.10.10.10.5060: SIP: INVITE sip:800@lab.local SIP/2.0
02:17:15.317253 IP 10.10.10.10.5060 > 10.10.10.20.5062: SIP: SIP/2.0 100 trying -- your call is important to us
02:17:15.317290 IP 10.10.10.10.5060 > 10.10.10.42.5080: SIP: INVITE sip:+97145550123@localcred.sip.vapi.ai SIP/2.0
02:17:15.317453 IP 10.10.10.42.5080 > 10.10.10.10.5060: SIP: SIP/2.0 100 Trying
02:17:15.318578 IP 10.10.10.42.5080 > 10.10.10.10.5060: SIP: SIP/2.0 180 Ringing
02:17:15.318662 IP 10.10.10.10.5060 > 10.10.10.20.5062: SIP: SIP/2.0 180 Ringing
02:17:15.319692 IP 10.10.10.42.5080 > 10.10.10.10.5060: SIP: SIP/2.0 200 OK
02:17:15.319779 IP 10.10.10.10.5060 > 10.10.10.20.5062: SIP: SIP/2.0 200 OK
02:17:15.319791 IP 10.10.10.20.5062 > 10.10.10.10.5060: SIP: ACK sip:800@lab.local SIP/2.0
02:17:15.336978 IP 10.10.10.20.5062 > 10.10.10.10.5060: SIP: INVITE sip:800@lab.local SIP/2.0
02:17:15.337548 IP 10.10.10.10.5060 > 10.10.10.20.5062: SIP: SIP/2.0 100 trying -- your call is important to us
02:17:15.337594 IP 10.10.10.10.5060 > 10.10.10.42.5080: SIP: INVITE sip:+97145550123@localcred.sip.vapi.ai SIP/2.0
02:17:15.337722 IP 10.10.10.42.5080 > 10.10.10.10.5060: SIP: SIP/2.0 100 Trying
02:17:15.338832 IP 10.10.10.42.5080 > 10.10.10.10.5060: SIP: SIP/2.0 180 Ringing
02:17:15.338945 IP 10.10.10.10.5060 > 10.10.10.20.5062: SIP: SIP/2.0 180 Ringing
02:17:15.340000 IP 10.10.10.42.5080 > 10.10.10.10.5060: SIP: SIP/2.0 200 OK
02:17:15.340122 IP 10.10.10.10.5060 > 10.10.10.20.5062: SIP: SIP/2.0 200 OK
02:17:15.340136 IP 10.10.10.20.5062 > 10.10.10.10.5060: SIP: ACK sip:800@lab.local SIP/2.0
02:17:15.356943 IP 10.10.10.20.5062 > 10.10.10.10.5060: SIP: INVITE sip:800@lab.local SIP/2.0
02:17:15.357189 IP 10.10.10.10.5060 > 10.10.10.20.5062: SIP: SIP/2.0 100 trying -- your call is important to us
02:17:15.357221 IP 10.10.10.10.5060 > 10.10.10.42.5080: SIP: INVITE sip:+97145550123@localcred.sip.vapi.ai SIP/2.0
02:17:15.357328 IP 10.10.10.42.5080 > 10.10.10.10.5060: SIP: SIP/2.0 100 Trying
02:17:15.358452 IP 10.10.10.42.5080 > 10.10.10.10.5060: SIP: SIP/2.0 180 Ringing
02:17:15.358527 IP 10.10.10.10.5060 > 10.10.10.20.5062: SIP: SIP/2.0 180 Ringing
02:17:15.359555 IP 10.10.10.42.5080 > 10.10.10.10.5060: SIP: SIP/2.0 200 OK
02:17:15.359726 IP 10.10.10.10.5060 > 10.10.10.20.5062: SIP: SIP/2.0 200 OK
02:17:15.359738 IP 10.10.10.20.5062 > 10.10.10.10.5060: SIP: ACK sip:800@lab.local SIP/2.0
02:17:15.376961 IP 10.10.10.20.5062 > 10.10.10.10.5060: SIP: INVITE sip:800@lab.local SIP/2.0
02:17:15.377291 IP 10.10.10.10.5060 > 10.10.10.20.5062: SIP: SIP/2.0 100 trying -- your call is important to us
02:17:15.377350 IP 10.10.10.10.5060 > 10.10.10.42.5080: SIP: INVITE sip:+97145550123@localcred.sip.vapi.ai SIP/2.0
02:17:15.377462 IP 10.10.10.42.5080 > 10.10.10.10.5060: SIP: SIP/2.0 100 Trying
02:17:15.378590 IP 10.10.10.42.5080 > 10.10.10.10.5060: SIP: SIP/2.0 180 Ringing
02:17:15.378704 IP 10.10.10.10.5060 > 10.10.10.20.5062: SIP: SIP/2.0 180 Ringing
02:17:15.379707 IP 10.10.10.42.5080 > 10.10.10.10.5060: SIP: SIP/2.0 200 OK
02:17:15.379829 IP 10.10.10.10.5060 > 10.10.10.20.5062: SIP: SIP/2.0 200 OK
02:17:15.379838 IP 10.10.10.20.5062 > 10.10.10.10.5060: SIP: ACK sip:800@lab.local SIP/2.0
02:17:15.396943 IP 10.10.10.20.5062 > 10.10.10.10.5060: SIP: INVITE sip:800@lab.local SIP/2.0
02:17:15.397232 IP 10.10.10.10.5060 > 10.10.10.20.5062: SIP: SIP/2.0 100 trying -- your call is important to us
02:17:15.397274 IP 10.10.10.10.5060 > 10.10.10.41.5070: SIP: INVITE sip:+97145550123@localcred.sip.vapi.ai SIP/2.0
02:17:15.397466 IP 10.10.10.41.5070 > 10.10.10.10.5060: SIP: SIP/2.0 100 Trying
02:17:15.398679 IP 10.10.10.41.5070 > 10.10.10.10.5060: SIP: SIP/2.0 180 Ringing
02:17:15.398758 IP 10.10.10.10.5060 > 10.10.10.20.5062: SIP: SIP/2.0 180 Ringing
02:17:15.399799 IP 10.10.10.41.5070 > 10.10.10.10.5060: SIP: SIP/2.0 200 OK
02:17:15.399911 IP 10.10.10.10.5060 > 10.10.10.20.5062: SIP: SIP/2.0 200 OK
02:17:15.399922 IP 10.10.10.20.5062 > 10.10.10.10.5060: SIP: ACK sip:800@lab.local SIP/2.0
02:17:15.416958 IP 10.10.10.20.5062 > 10.10.10.10.5060: SIP: INVITE sip:800@lab.local SIP/2.0
02:17:15.417263 IP 10.10.10.10.5060 > 10.10.10.20.5062: SIP: SIP/2.0 100 trying -- your call is important to us
02:17:15.417300 IP 10.10.10.10.5060 > 10.10.10.41.5070: SIP: INVITE sip:+97145550123@localcred.sip.vapi.ai SIP/2.0
02:17:15.417405 IP 10.10.10.41.5070 > 10.10.10.10.5060: SIP: SIP/2.0 100 Trying
02:17:15.418537 IP 10.10.10.41.5070 > 10.10.10.10.5060: SIP: SIP/2.0 180 Ringing
02:17:15.419000 IP 10.10.10.10.5060 > 10.10.10.42.5080: SIP: INVITE sip:+97145550123@localcred.sip.vapi.ai SIP/2.0
02:17:15.419126 IP 10.10.10.10.5060 > 10.10.10.41.5070: SIP: CANCEL sip:+97145550123@localcred.sip.vapi.ai SIP/2.0
02:17:15.419168 IP 10.10.10.42.5080 > 10.10.10.10.5060: SIP: SIP/2.0 100 Trying
02:17:15.419207 IP 10.10.10.10.5060 > 10.10.10.41.5070: SIP: CANCEL sip:+97145550123@localcred.sip.vapi.ai SIP/2.0
02:17:15.419239 IP 10.10.10.41.5070 > 10.10.10.10.5060: SIP: SIP/2.0 200 OK
02:17:15.419284 IP 10.10.10.41.5070 > 10.10.10.10.5060: SIP: SIP/2.0 200 OK
02:17:15.420362 IP 10.10.10.42.5080 > 10.10.10.10.5060: SIP: SIP/2.0 180 Ringing
02:17:15.420502 IP 10.10.10.10.5060 > 10.10.10.20.5062: SIP: SIP/2.0 180 Ringing
02:17:15.421585 IP 10.10.10.42.5080 > 10.10.10.10.5060: SIP: SIP/2.0 200 OK
02:17:15.421830 IP 10.10.10.10.5060 > 10.10.10.20.5062: SIP: SIP/2.0 200 OK
02:17:15.421843 IP 10.10.10.20.5062 > 10.10.10.10.5060: SIP: ACK sip:800@lab.local SIP/2.0
02:17:15.436965 IP 10.10.10.20.5062 > 10.10.10.10.5060: SIP: INVITE sip:800@lab.local SIP/2.0
02:17:15.437382 IP 10.10.10.10.5060 > 10.10.10.20.5062: SIP: SIP/2.0 100 trying -- your call is important to us
02:17:15.437428 IP 10.10.10.10.5060 > 10.10.10.42.5080: SIP: INVITE sip:+97145550123@localcred.sip.vapi.ai SIP/2.0
02:17:15.437549 IP 10.10.10.42.5080 > 10.10.10.10.5060: SIP: SIP/2.0 100 Trying
02:17:15.438674 IP 10.10.10.42.5080 > 10.10.10.10.5060: SIP: SIP/2.0 180 Ringing
02:17:15.438917 IP 10.10.10.10.5060 > 10.10.10.20.5062: SIP: SIP/2.0 180 Ringing
02:17:15.439756 IP 10.10.10.42.5080 > 10.10.10.10.5060: SIP: SIP/2.0 200 OK
02:17:15.439887 IP 10.10.10.10.5060 > 10.10.10.20.5062: SIP: SIP/2.0 200 OK
02:17:15.439899 IP 10.10.10.20.5062 > 10.10.10.10.5060: SIP: ACK sip:800@lab.local SIP/2.0
02:17:15.456998 IP 10.10.10.20.5062 > 10.10.10.10.5060: SIP: INVITE sip:800@lab.local SIP/2.0
02:17:15.457366 IP 10.10.10.10.5060 > 10.10.10.20.5062: SIP: SIP/2.0 100 trying -- your call is important to us
02:17:15.457415 IP 10.10.10.10.5060 > 10.10.10.42.5080: SIP: INVITE sip:+97145550123@localcred.sip.vapi.ai SIP/2.0
02:17:15.457561 IP 10.10.10.42.5080 > 10.10.10.10.5060: SIP: SIP/2.0 100 Trying
02:17:15.458698 IP 10.10.10.42.5080 > 10.10.10.10.5060: SIP: SIP/2.0 180 Ringing
02:17:15.458819 IP 10.10.10.10.5060 > 10.10.10.20.5062: SIP: SIP/2.0 180 Ringing
02:17:15.459798 IP 10.10.10.42.5080 > 10.10.10.10.5060: SIP: SIP/2.0 200 OK
02:17:15.459939 IP 10.10.10.10.5060 > 10.10.10.20.5062: SIP: SIP/2.0 200 OK
02:17:15.459968 IP 10.10.10.20.5062 > 10.10.10.10.5060: SIP: ACK sip:800@lab.local SIP/2.0
02:17:15.477023 IP 10.10.10.20.5062 > 10.10.10.10.5060: SIP: INVITE sip:800@lab.local SIP/2.0
02:17:15.477461 IP 10.10.10.10.5060 > 10.10.10.20.5062: SIP: SIP/2.0 100 trying -- your call is important to us
02:17:15.477505 IP 10.10.10.10.5060 > 10.10.10.42.5080: SIP: INVITE sip:+97145550123@localcred.sip.vapi.ai SIP/2.0
02:17:15.477652 IP 10.10.10.42.5080 > 10.10.10.10.5060: SIP: SIP/2.0 100 Trying
02:17:15.478744 IP 10.10.10.42.5080 > 10.10.10.10.5060: SIP: SIP/2.0 180 Ringing
02:17:15.478875 IP 10.10.10.10.5060 > 10.10.10.20.5062: SIP: SIP/2.0 180 Ringing
02:17:15.480000 IP 10.10.10.42.5080 > 10.10.10.10.5060: SIP: SIP/2.0 200 OK
02:17:15.480175 IP 10.10.10.10.5060 > 10.10.10.20.5062: SIP: SIP/2.0 200 OK
02:17:15.480187 IP 10.10.10.20.5062 > 10.10.10.10.5060: SIP: ACK sip:800@lab.local SIP/2.0
02:17:15.496946 IP 10.10.10.20.5062 > 10.10.10.10.5060: SIP: INVITE sip:800@lab.local SIP/2.0
02:17:15.497240 IP 10.10.10.10.5060 > 10.10.10.20.5062: SIP: SIP/2.0 100 trying -- your call is important to us
02:17:15.497279 IP 10.10.10.10.5060 > 10.10.10.42.5080: SIP: INVITE sip:+97145550123@localcred.sip.vapi.ai SIP/2.0
02:17:15.497409 IP 10.10.10.42.5080 > 10.10.10.10.5060: SIP: SIP/2.0 100 Trying
02:17:15.498549 IP 10.10.10.42.5080 > 10.10.10.10.5060: SIP: SIP/2.0 180 Ringing
02:17:15.498668 IP 10.10.10.10.5060 > 10.10.10.20.5062: SIP: SIP/2.0 180 Ringing
02:17:15.499683 IP 10.10.10.42.5080 > 10.10.10.10.5060: SIP: SIP/2.0 200 OK
02:17:15.499807 IP 10.10.10.10.5060 > 10.10.10.20.5062: SIP: SIP/2.0 200 OK
02:17:15.499818 IP 10.10.10.20.5062 > 10.10.10.10.5060: SIP: ACK sip:800@lab.local SIP/2.0
02:17:15.516949 IP 10.10.10.20.5062 > 10.10.10.10.5060: SIP: INVITE sip:800@lab.local SIP/2.0
02:17:15.517068 IP 10.10.10.10.5060 > 10.10.10.20.5062: SIP: SIP/2.0 503 Rate Limit Exceeded
02:17:15.517152 IP 10.10.10.20.5062 > 10.10.10.10.5060: SIP: ACK sip:800@lab.local SIP/2.0
02:17:15.536945 IP 10.10.10.20.5062 > 10.10.10.10.5060: SIP: INVITE sip:800@lab.local SIP/2.0
02:17:15.537114 IP 10.10.10.10.5060 > 10.10.10.20.5062: SIP: SIP/2.0 503 Rate Limit Exceeded
02:17:15.537153 IP 10.10.10.20.5062 > 10.10.10.10.5060: SIP: ACK sip:800@lab.local SIP/2.0
02:17:15.556942 IP 10.10.10.20.5062 > 10.10.10.10.5060: SIP: INVITE sip:800@lab.local SIP/2.0
02:17:15.557071 IP 10.10.10.10.5060 > 10.10.10.20.5062: SIP: SIP/2.0 503 Rate Limit Exceeded
02:17:15.557103 IP 10.10.10.20.5062 > 10.10.10.10.5060: SIP: ACK sip:800@lab.local SIP/2.0
02:17:15.576958 IP 10.10.10.20.5062 > 10.10.10.10.5060: SIP: INVITE sip:800@lab.local SIP/2.0
02:17:15.577142 IP 10.10.10.10.5060 > 10.10.10.20.5062: SIP: SIP/2.0 503 Rate Limit Exceeded
02:17:15.577184 IP 10.10.10.20.5062 > 10.10.10.10.5060: SIP: ACK sip:800@lab.local SIP/2.0
02:17:15.597059 IP 10.10.10.20.5062 > 10.10.10.10.5060: SIP: INVITE sip:800@lab.local SIP/2.0
02:17:15.597423 IP 10.10.10.10.5060 > 10.10.10.20.5062: SIP: SIP/2.0 503 Rate Limit Exceeded
02:17:15.597488 IP 10.10.10.20.5062 > 10.10.10.10.5060: SIP: ACK sip:800@lab.local SIP/2.0
02:17:15.616991 IP 10.10.10.20.5062 > 10.10.10.10.5060: SIP: INVITE sip:800@lab.local SIP/2.0
02:17:15.617201 IP 10.10.10.10.5060 > 10.10.10.20.5062: SIP: SIP/2.0 503 Rate Limit Exceeded
02:17:15.617257 IP 10.10.10.20.5062 > 10.10.10.10.5060: SIP: ACK sip:800@lab.local SIP/2.0
02:17:15.636949 IP 10.10.10.20.5062 > 10.10.10.10.5060: SIP: INVITE sip:800@lab.local SIP/2.0
02:17:15.637188 IP 10.10.10.10.5060 > 10.10.10.20.5062: SIP: SIP/2.0 503 Rate Limit Exceeded
02:17:15.637222 IP 10.10.10.20.5062 > 10.10.10.10.5060: SIP: ACK sip:800@lab.local SIP/2.0
02:17:15.656953 IP 10.10.10.20.5062 > 10.10.10.10.5060: SIP: INVITE sip:800@lab.local SIP/2.0
02:17:15.657146 IP 10.10.10.10.5060 > 10.10.10.20.5062: SIP: SIP/2.0 503 Rate Limit Exceeded
02:17:15.657174 IP 10.10.10.20.5062 > 10.10.10.10.5060: SIP: ACK sip:800@lab.local SIP/2.0
02:17:15.676946 IP 10.10.10.20.5062 > 10.10.10.10.5060: SIP: INVITE sip:800@lab.local SIP/2.0
02:17:15.677187 IP 10.10.10.10.5060 > 10.10.10.20.5062: SIP: SIP/2.0 503 Rate Limit Exceeded
02:17:15.677235 IP 10.10.10.20.5062 > 10.10.10.10.5060: SIP: ACK sip:800@lab.local SIP/2.0
02:17:15.696935 IP 10.10.10.20.5062 > 10.10.10.10.5060: SIP: INVITE sip:800@lab.local SIP/2.0
02:17:15.697148 IP 10.10.10.10.5060 > 10.10.10.20.5062: SIP: SIP/2.0 503 Rate Limit Exceeded
02:17:15.697171 IP 10.10.10.20.5062 > 10.10.10.10.5060: SIP: ACK sip:800@lab.local SIP/2.0
02:17:15.716951 IP 10.10.10.20.5062 > 10.10.10.10.5060: SIP: INVITE sip:800@lab.local SIP/2.0
02:17:15.717253 IP 10.10.10.10.5060 > 10.10.10.20.5062: SIP: SIP/2.0 503 Rate Limit Exceeded
02:17:15.717281 IP 10.10.10.20.5062 > 10.10.10.10.5060: SIP: ACK sip:800@lab.local SIP/2.0
02:17:15.736929 IP 10.10.10.20.5062 > 10.10.10.10.5060: SIP: INVITE sip:800@lab.local SIP/2.0
02:17:15.737067 IP 10.10.10.10.5060 > 10.10.10.20.5062: SIP: SIP/2.0 503 Rate Limit Exceeded
02:17:15.737085 IP 10.10.10.20.5062 > 10.10.10.10.5060: SIP: ACK sip:800@lab.local SIP/2.0
02:17:15.756945 IP 10.10.10.20.5062 > 10.10.10.10.5060: SIP: INVITE sip:800@lab.local SIP/2.0
02:17:15.757135 IP 10.10.10.10.5060 > 10.10.10.20.5062: SIP: SIP/2.0 503 Rate Limit Exceeded
02:17:15.757164 IP 10.10.10.20.5062 > 10.10.10.10.5060: SIP: ACK sip:800@lab.local SIP/2.0
02:17:15.776932 IP 10.10.10.20.5062 > 10.10.10.10.5060: SIP: INVITE sip:800@lab.local SIP/2.0
02:17:15.777070 IP 10.10.10.10.5060 > 10.10.10.20.5062: SIP: SIP/2.0 503 Rate Limit Exceeded
02:17:15.779810 IP 10.10.10.20.5062 > 10.10.10.10.5060: SIP: ACK sip:800@lab.local SIP/2.0
02:17:15.796949 IP 10.10.10.20.5062 > 10.10.10.10.5060: SIP: INVITE sip:800@lab.local SIP/2.0
02:17:15.797067 IP 10.10.10.10.5060 > 10.10.10.20.5062: SIP: SIP/2.0 503 Rate Limit Exceeded
02:17:15.797106 IP 10.10.10.20.5062 > 10.10.10.10.5060: SIP: ACK sip:800@lab.local SIP/2.0
02:17:15.816936 IP 10.10.10.20.5062 > 10.10.10.10.5060: SIP: INVITE sip:800@lab.local SIP/2.0
02:17:15.817047 IP 10.10.10.10.5060 > 10.10.10.20.5062: SIP: SIP/2.0 503 Rate Limit Exceeded
02:17:15.817072 IP 10.10.10.20.5062 > 10.10.10.10.5060: SIP: ACK sip:800@lab.local SIP/2.0
02:17:15.836968 IP 10.10.10.20.5062 > 10.10.10.10.5060: SIP: INVITE sip:800@lab.local SIP/2.0
02:17:15.837166 IP 10.10.10.10.5060 > 10.10.10.20.5062: SIP: SIP/2.0 503 Rate Limit Exceeded
02:17:15.837215 IP 10.10.10.20.5062 > 10.10.10.10.5060: SIP: ACK sip:800@lab.local SIP/2.0
02:17:15.856961 IP 10.10.10.20.5062 > 10.10.10.10.5060: SIP: INVITE sip:800@lab.local SIP/2.0
02:17:15.857141 IP 10.10.10.10.5060 > 10.10.10.20.5062: SIP: SIP/2.0 503 Rate Limit Exceeded
02:17:15.857188 IP 10.10.10.20.5062 > 10.10.10.10.5060: SIP: ACK sip:800@lab.local SIP/2.0
02:17:15.876955 IP 10.10.10.20.5062 > 10.10.10.10.5060: SIP: INVITE sip:800@lab.local SIP/2.0
02:17:15.877163 IP 10.10.10.10.5060 > 10.10.10.20.5062: SIP: SIP/2.0 503 Rate Limit Exceeded
02:17:15.877204 IP 10.10.10.20.5062 > 10.10.10.10.5060: SIP: ACK sip:800@lab.local SIP/2.0
02:17:15.896977 IP 10.10.10.20.5062 > 10.10.10.10.5060: SIP: INVITE sip:800@lab.local SIP/2.0
02:17:15.897165 IP 10.10.10.10.5060 > 10.10.10.20.5062: SIP: SIP/2.0 503 Rate Limit Exceeded
02:17:15.897214 IP 10.10.10.20.5062 > 10.10.10.10.5060: SIP: ACK sip:800@lab.local SIP/2.0
02:17:15.916943 IP 10.10.10.20.5062 > 10.10.10.10.5060: SIP: INVITE sip:800@lab.local SIP/2.0
02:17:15.917068 IP 10.10.10.10.5060 > 10.10.10.20.5062: SIP: SIP/2.0 503 Rate Limit Exceeded
02:17:15.917100 IP 10.10.10.20.5062 > 10.10.10.10.5060: SIP: ACK sip:800@lab.local SIP/2.0
02:17:15.936980 IP 10.10.10.20.5062 > 10.10.10.10.5060: SIP: INVITE sip:800@lab.local SIP/2.0
02:17:15.937162 IP 10.10.10.10.5060 > 10.10.10.20.5062: SIP: SIP/2.0 503 Rate Limit Exceeded
02:17:15.937209 IP 10.10.10.20.5062 > 10.10.10.10.5060: SIP: ACK sip:800@lab.local SIP/2.0
02:17:15.956974 IP 10.10.10.20.5062 > 10.10.10.10.5060: SIP: INVITE sip:800@lab.local SIP/2.0
02:17:15.957159 IP 10.10.10.10.5060 > 10.10.10.20.5062: SIP: SIP/2.0 503 Rate Limit Exceeded
02:17:15.957196 IP 10.10.10.20.5062 > 10.10.10.10.5060: SIP: ACK sip:800@lab.local SIP/2.0
02:17:15.976952 IP 10.10.10.20.5062 > 10.10.10.10.5060: SIP: INVITE sip:800@lab.local SIP/2.0
02:17:15.977125 IP 10.10.10.10.5060 > 10.10.10.20.5062: SIP: SIP/2.0 503 Rate Limit Exceeded
02:17:15.977166 IP 10.10.10.20.5062 > 10.10.10.10.5060: SIP: ACK sip:800@lab.local SIP/2.0
02:17:15.996952 IP 10.10.10.20.5062 > 10.10.10.10.5060: SIP: INVITE sip:800@lab.local SIP/2.0
02:17:15.997140 IP 10.10.10.10.5060 > 10.10.10.20.5062: SIP: SIP/2.0 503 Rate Limit Exceeded
02:17:15.997186 IP 10.10.10.20.5062 > 10.10.10.10.5060: SIP: ACK sip:800@lab.local SIP/2.0
02:17:16.016931 IP 10.10.10.20.5062 > 10.10.10.10.5060: SIP: INVITE sip:800@lab.local SIP/2.0
02:17:16.017104 IP 10.10.10.10.5060 > 10.10.10.20.5062: SIP: SIP/2.0 503 Rate Limit Exceeded
02:17:16.017129 IP 10.10.10.20.5062 > 10.10.10.10.5060: SIP: ACK sip:800@lab.local SIP/2.0
02:17:16.036950 IP 10.10.10.20.5062 > 10.10.10.10.5060: SIP: INVITE sip:800@lab.local SIP/2.0
02:17:16.037105 IP 10.10.10.10.5060 > 10.10.10.20.5062: SIP: SIP/2.0 503 Rate Limit Exceeded
02:17:16.037144 IP 10.10.10.20.5062 > 10.10.10.10.5060: SIP: ACK sip:800@lab.local SIP/2.0
02:17:16.056932 IP 10.10.10.20.5062 > 10.10.10.10.5060: SIP: INVITE sip:800@lab.local SIP/2.0
02:17:16.057033 IP 10.10.10.10.5060 > 10.10.10.20.5062: SIP: SIP/2.0 503 Rate Limit Exceeded
02:17:16.057056 IP 10.10.10.20.5062 > 10.10.10.10.5060: SIP: ACK sip:800@lab.local SIP/2.0
02:17:16.077057 IP 10.10.10.20.5062 > 10.10.10.10.5060: SIP: INVITE sip:800@lab.local SIP/2.0
02:17:16.077234 IP 10.10.10.10.5060 > 10.10.10.20.5062: SIP: SIP/2.0 503 Rate Limit Exceeded
02:17:16.077279 IP 10.10.10.20.5062 > 10.10.10.10.5060: SIP: ACK sip:800@lab.local SIP/2.0
02:17:16.097023 IP 10.10.10.20.5062 > 10.10.10.10.5060: SIP: INVITE sip:800@lab.local SIP/2.0
02:17:16.097203 IP 10.10.10.10.5060 > 10.10.10.20.5062: SIP: SIP/2.0 503 Rate Limit Exceeded
02:17:16.097245 IP 10.10.10.20.5062 > 10.10.10.10.5060: SIP: ACK sip:800@lab.local SIP/2.0
02:17:16.117012 IP 10.10.10.20.5062 > 10.10.10.10.5060: SIP: INVITE sip:800@lab.local SIP/2.0
02:17:16.117213 IP 10.10.10.10.5060 > 10.10.10.20.5062: SIP: SIP/2.0 503 Rate Limit Exceeded
02:17:16.117254 IP 10.10.10.20.5062 > 10.10.10.10.5060: SIP: ACK sip:800@lab.local SIP/2.0
02:17:16.136953 IP 10.10.10.20.5062 > 10.10.10.10.5060: SIP: INVITE sip:800@lab.local SIP/2.0
02:17:16.137145 IP 10.10.10.10.5060 > 10.10.10.20.5062: SIP: SIP/2.0 503 Rate Limit Exceeded
02:17:16.137184 IP 10.10.10.20.5062 > 10.10.10.10.5060: SIP: ACK sip:800@lab.local SIP/2.0
02:17:16.156949 IP 10.10.10.20.5062 > 10.10.10.10.5060: SIP: INVITE sip:800@lab.local SIP/2.0
02:17:16.157109 IP 10.10.10.10.5060 > 10.10.10.20.5062: SIP: SIP/2.0 503 Rate Limit Exceeded
02:17:16.157146 IP 10.10.10.20.5062 > 10.10.10.10.5060: SIP: ACK sip:800@lab.local SIP/2.0
02:17:16.176974 IP 10.10.10.20.5062 > 10.10.10.10.5060: SIP: INVITE sip:800@lab.local SIP/2.0
02:17:16.177206 IP 10.10.10.10.5060 > 10.10.10.20.5062: SIP: SIP/2.0 503 Rate Limit Exceeded
02:17:16.177257 IP 10.10.10.20.5062 > 10.10.10.10.5060: SIP: ACK sip:800@lab.local SIP/2.0
02:17:16.196944 IP 10.10.10.20.5062 > 10.10.10.10.5060: SIP: INVITE sip:800@lab.local SIP/2.0
02:17:16.197067 IP 10.10.10.10.5060 > 10.10.10.20.5062: SIP: SIP/2.0 503 Rate Limit Exceeded
02:17:16.197106 IP 10.10.10.20.5062 > 10.10.10.10.5060: SIP: ACK sip:800@lab.local SIP/2.0
02:17:16.216964 IP 10.10.10.20.5062 > 10.10.10.10.5060: SIP: INVITE sip:800@lab.local SIP/2.0
02:17:16.217108 IP 10.10.10.10.5060 > 10.10.10.20.5062: SIP: SIP/2.0 503 Rate Limit Exceeded
02:17:16.217175 IP 10.10.10.20.5062 > 10.10.10.10.5060: SIP: ACK sip:800@lab.local SIP/2.0
02:17:16.236942 IP 10.10.10.20.5062 > 10.10.10.10.5060: SIP: INVITE sip:800@lab.local SIP/2.0
02:17:16.237085 IP 10.10.10.10.5060 > 10.10.10.20.5062: SIP: SIP/2.0 503 Rate Limit Exceeded
02:17:16.237126 IP 10.10.10.20.5062 > 10.10.10.10.5060: SIP: ACK sip:800@lab.local SIP/2.0
02:17:16.256952 IP 10.10.10.20.5062 > 10.10.10.10.5060: SIP: INVITE sip:800@lab.local SIP/2.0
02:17:16.257113 IP 10.10.10.10.5060 > 10.10.10.20.5062: SIP: SIP/2.0 503 Rate Limit Exceeded
02:17:16.257152 IP 10.10.10.20.5062 > 10.10.10.10.5060: SIP: ACK sip:800@lab.local SIP/2.0
02:17:16.276982 IP 10.10.10.20.5062 > 10.10.10.10.5060: SIP: INVITE sip:800@lab.local SIP/2.0
02:17:16.277155 IP 10.10.10.10.5060 > 10.10.10.20.5062: SIP: SIP/2.0 503 Rate Limit Exceeded
02:17:16.277199 IP 10.10.10.20.5062 > 10.10.10.10.5060: SIP: ACK sip:800@lab.local SIP/2.0
02:17:16.296938 IP 10.10.10.20.5062 > 10.10.10.10.5060: SIP: INVITE sip:800@lab.local SIP/2.0
02:17:16.297047 IP 10.10.10.10.5060 > 10.10.10.20.5062: SIP: SIP/2.0 503 Rate Limit Exceeded
02:17:16.297079 IP 10.10.10.20.5062 > 10.10.10.10.5060: SIP: ACK sip:800@lab.local SIP/2.0
02:17:16.316970 IP 10.10.10.20.5062 > 10.10.10.10.5060: SIP: INVITE sip:800@lab.local SIP/2.0
02:17:16.317145 IP 10.10.10.10.5060 > 10.10.10.20.5062: SIP: SIP/2.0 503 Rate Limit Exceeded
02:17:16.317193 IP 10.10.10.20.5062 > 10.10.10.10.5060: SIP: ACK sip:800@lab.local SIP/2.0
02:17:16.336930 IP 10.10.10.20.5062 > 10.10.10.10.5060: SIP: INVITE sip:800@lab.local SIP/2.0
02:17:16.337037 IP 10.10.10.10.5060 > 10.10.10.20.5062: SIP: SIP/2.0 503 Rate Limit Exceeded
02:17:16.337058 IP 10.10.10.20.5062 > 10.10.10.10.5060: SIP: ACK sip:800@lab.local SIP/2.0
02:17:16.356973 IP 10.10.10.20.5062 > 10.10.10.10.5060: SIP: INVITE sip:800@lab.local SIP/2.0
02:17:16.357136 IP 10.10.10.10.5060 > 10.10.10.20.5062: SIP: SIP/2.0 503 Rate Limit Exceeded
02:17:16.357193 IP 10.10.10.20.5062 > 10.10.10.10.5060: SIP: ACK sip:800@lab.local SIP/2.0
02:17:16.376956 IP 10.10.10.20.5062 > 10.10.10.10.5060: SIP: INVITE sip:800@lab.local SIP/2.0
02:17:16.377108 IP 10.10.10.10.5060 > 10.10.10.20.5062: SIP: SIP/2.0 503 Rate Limit Exceeded
02:17:16.377156 IP 10.10.10.20.5062 > 10.10.10.10.5060: SIP: ACK sip:800@lab.local SIP/2.0
02:17:16.396972 IP 10.10.10.20.5062 > 10.10.10.10.5060: SIP: INVITE sip:800@lab.local SIP/2.0
02:17:16.397188 IP 10.10.10.10.5060 > 10.10.10.20.5062: SIP: SIP/2.0 503 Rate Limit Exceeded
02:17:16.397236 IP 10.10.10.20.5062 > 10.10.10.10.5060: SIP: ACK sip:800@lab.local SIP/2.0
02:17:16.416935 IP 10.10.10.20.5062 > 10.10.10.10.5060: SIP: INVITE sip:800@lab.local SIP/2.0
02:17:16.417061 IP 10.10.10.10.5060 > 10.10.10.20.5062: SIP: SIP/2.0 503 Rate Limit Exceeded
02:17:16.417086 IP 10.10.10.20.5062 > 10.10.10.10.5060: SIP: ACK sip:800@lab.local SIP/2.0
02:17:16.436945 IP 10.10.10.20.5062 > 10.10.10.10.5060: SIP: INVITE sip:800@lab.local SIP/2.0
02:17:16.437150 IP 10.10.10.10.5060 > 10.10.10.20.5062: SIP: SIP/2.0 503 Rate Limit Exceeded
02:17:16.437180 IP 10.10.10.20.5062 > 10.10.10.10.5060: SIP: ACK sip:800@lab.local SIP/2.0
02:17:16.456976 IP 10.10.10.20.5062 > 10.10.10.10.5060: SIP: INVITE sip:800@lab.local SIP/2.0
02:17:16.457193 IP 10.10.10.10.5060 > 10.10.10.20.5062: SIP: SIP/2.0 503 Rate Limit Exceeded
02:17:16.457245 IP 10.10.10.20.5062 > 10.10.10.10.5060: SIP: ACK sip:800@lab.local SIP/2.0
02:17:16.476955 IP 10.10.10.20.5062 > 10.10.10.10.5060: SIP: INVITE sip:800@lab.local SIP/2.0
02:17:16.477209 IP 10.10.10.10.5060 > 10.10.10.20.5062: SIP: SIP/2.0 503 Rate Limit Exceeded
02:17:16.477250 IP 10.10.10.20.5062 > 10.10.10.10.5060: SIP: ACK sip:800@lab.local SIP/2.0
02:17:16.496985 IP 10.10.10.20.5062 > 10.10.10.10.5060: SIP: INVITE sip:800@lab.local SIP/2.0
02:17:16.497278 IP 10.10.10.10.5060 > 10.10.10.20.5062: SIP: SIP/2.0 503 Rate Limit Exceeded
02:17:16.497339 IP 10.10.10.20.5062 > 10.10.10.10.5060: SIP: ACK sip:800@lab.local SIP/2.0
02:17:16.516973 IP 10.10.10.20.5062 > 10.10.10.10.5060: SIP: INVITE sip:800@lab.local SIP/2.0
02:17:16.517199 IP 10.10.10.10.5060 > 10.10.10.20.5062: SIP: SIP/2.0 503 Rate Limit Exceeded
02:17:16.517257 IP 10.10.10.20.5062 > 10.10.10.10.5060: SIP: ACK sip:800@lab.local SIP/2.0
02:17:16.536957 IP 10.10.10.20.5062 > 10.10.10.10.5060: SIP: INVITE sip:800@lab.local SIP/2.0
02:17:16.537174 IP 10.10.10.10.5060 > 10.10.10.20.5062: SIP: SIP/2.0 503 Rate Limit Exceeded
02:17:16.537225 IP 10.10.10.20.5062 > 10.10.10.10.5060: SIP: ACK sip:800@lab.local SIP/2.0
02:17:16.557007 IP 10.10.10.20.5062 > 10.10.10.10.5060: SIP: INVITE sip:800@lab.local SIP/2.0
02:17:16.557202 IP 10.10.10.10.5060 > 10.10.10.20.5062: SIP: SIP/2.0 503 Rate Limit Exceeded
02:17:16.557253 IP 10.10.10.20.5062 > 10.10.10.10.5060: SIP: ACK sip:800@lab.local SIP/2.0
02:17:16.576978 IP 10.10.10.20.5062 > 10.10.10.10.5060: SIP: INVITE sip:800@lab.local SIP/2.0
02:17:16.577236 IP 10.10.10.10.5060 > 10.10.10.20.5062: SIP: SIP/2.0 503 Rate Limit Exceeded
02:17:16.577281 IP 10.10.10.20.5062 > 10.10.10.10.5060: SIP: ACK sip:800@lab.local SIP/2.0
02:17:16.596944 IP 10.10.10.20.5062 > 10.10.10.10.5060: SIP: INVITE sip:800@lab.local SIP/2.0
02:17:16.597168 IP 10.10.10.10.5060 > 10.10.10.20.5062: SIP: SIP/2.0 503 Rate Limit Exceeded
02:17:16.597198 IP 10.10.10.20.5062 > 10.10.10.10.5060: SIP: ACK sip:800@lab.local SIP/2.0
02:17:16.616985 IP 10.10.10.20.5062 > 10.10.10.10.5060: SIP: INVITE sip:800@lab.local SIP/2.0
02:17:16.617222 IP 10.10.10.10.5060 > 10.10.10.20.5062: SIP: SIP/2.0 503 Rate Limit Exceeded
02:17:16.617278 IP 10.10.10.20.5062 > 10.10.10.10.5060: SIP: ACK sip:800@lab.local SIP/2.0
02:17:16.636973 IP 10.10.10.20.5062 > 10.10.10.10.5060: SIP: INVITE sip:800@lab.local SIP/2.0
02:17:16.637159 IP 10.10.10.10.5060 > 10.10.10.20.5062: SIP: SIP/2.0 503 Rate Limit Exceeded
02:17:16.637210 IP 10.10.10.20.5062 > 10.10.10.10.5060: SIP: ACK sip:800@lab.local SIP/2.0
02:17:16.656972 IP 10.10.10.20.5062 > 10.10.10.10.5060: SIP: INVITE sip:800@lab.local SIP/2.0
02:17:16.657282 IP 10.10.10.10.5060 > 10.10.10.20.5062: SIP: SIP/2.0 503 Rate Limit Exceeded
02:17:16.657334 IP 10.10.10.20.5062 > 10.10.10.10.5060: SIP: ACK sip:800@lab.local SIP/2.0
02:17:16.676978 IP 10.10.10.20.5062 > 10.10.10.10.5060: SIP: INVITE sip:800@lab.local SIP/2.0
02:17:16.677180 IP 10.10.10.10.5060 > 10.10.10.20.5062: SIP: SIP/2.0 503 Rate Limit Exceeded
02:17:16.677234 IP 10.10.10.20.5062 > 10.10.10.10.5060: SIP: ACK sip:800@lab.local SIP/2.0
02:17:16.696950 IP 10.10.10.20.5062 > 10.10.10.10.5060: SIP: INVITE sip:800@lab.local SIP/2.0
02:17:16.697163 IP 10.10.10.10.5060 > 10.10.10.20.5062: SIP: SIP/2.0 503 Rate Limit Exceeded
02:17:16.697200 IP 10.10.10.20.5062 > 10.10.10.10.5060: SIP: ACK sip:800@lab.local SIP/2.0
02:17:16.716928 IP 10.10.10.20.5062 > 10.10.10.10.5060: SIP: INVITE sip:800@lab.local SIP/2.0
02:17:16.717071 IP 10.10.10.10.5060 > 10.10.10.20.5062: SIP: SIP/2.0 503 Rate Limit Exceeded
02:17:16.717096 IP 10.10.10.20.5062 > 10.10.10.10.5060: SIP: ACK sip:800@lab.local SIP/2.0
02:17:16.736965 IP 10.10.10.20.5062 > 10.10.10.10.5060: SIP: INVITE sip:800@lab.local SIP/2.0
02:17:16.737173 IP 10.10.10.10.5060 > 10.10.10.20.5062: SIP: SIP/2.0 503 Rate Limit Exceeded
02:17:16.737219 IP 10.10.10.20.5062 > 10.10.10.10.5060: SIP: ACK sip:800@lab.local SIP/2.0
02:17:16.756935 IP 10.10.10.20.5062 > 10.10.10.10.5060: SIP: INVITE sip:800@lab.local SIP/2.0
02:17:16.757112 IP 10.10.10.10.5060 > 10.10.10.20.5062: SIP: SIP/2.0 503 Rate Limit Exceeded
02:17:16.757135 IP 10.10.10.20.5062 > 10.10.10.10.5060: SIP: ACK sip:800@lab.local SIP/2.0
02:17:16.776961 IP 10.10.10.20.5062 > 10.10.10.10.5060: SIP: INVITE sip:800@lab.local SIP/2.0
02:17:16.777133 IP 10.10.10.10.5060 > 10.10.10.20.5062: SIP: SIP/2.0 503 Rate Limit Exceeded
02:17:16.777175 IP 10.10.10.20.5062 > 10.10.10.10.5060: SIP: ACK sip:800@lab.local SIP/2.0
02:17:16.796931 IP 10.10.10.20.5062 > 10.10.10.10.5060: SIP: INVITE sip:800@lab.local SIP/2.0
02:17:16.797067 IP 10.10.10.10.5060 > 10.10.10.20.5062: SIP: SIP/2.0 503 Rate Limit Exceeded
02:17:16.797092 IP 10.10.10.20.5062 > 10.10.10.10.5060: SIP: ACK sip:800@lab.local SIP/2.0
02:17:16.816941 IP 10.10.10.20.5062 > 10.10.10.10.5060: SIP: INVITE sip:800@lab.local SIP/2.0
02:17:16.817066 IP 10.10.10.10.5060 > 10.10.10.20.5062: SIP: SIP/2.0 503 Rate Limit Exceeded
02:17:16.817099 IP 10.10.10.20.5062 > 10.10.10.10.5060: SIP: ACK sip:800@lab.local SIP/2.0
02:17:16.836945 IP 10.10.10.20.5062 > 10.10.10.10.5060: SIP: INVITE sip:800@lab.local SIP/2.0
02:17:16.837138 IP 10.10.10.10.5060 > 10.10.10.20.5062: SIP: SIP/2.0 503 Rate Limit Exceeded
02:17:16.837173 IP 10.10.10.20.5062 > 10.10.10.10.5060: SIP: ACK sip:800@lab.local SIP/2.0
02:17:16.856929 IP 10.10.10.20.5062 > 10.10.10.10.5060: SIP: INVITE sip:800@lab.local SIP/2.0
02:17:16.857058 IP 10.10.10.10.5060 > 10.10.10.20.5062: SIP: SIP/2.0 503 Rate Limit Exceeded
02:17:16.857079 IP 10.10.10.20.5062 > 10.10.10.10.5060: SIP: ACK sip:800@lab.local SIP/2.0
02:17:16.876980 IP 10.10.10.20.5062 > 10.10.10.10.5060: SIP: INVITE sip:800@lab.local SIP/2.0
02:17:16.877153 IP 10.10.10.10.5060 > 10.10.10.20.5062: SIP: SIP/2.0 503 Rate Limit Exceeded
02:17:16.877221 IP 10.10.10.20.5062 > 10.10.10.10.5060: SIP: ACK sip:800@lab.local SIP/2.0
02:17:16.896933 IP 10.10.10.20.5062 > 10.10.10.10.5060: SIP: INVITE sip:800@lab.local SIP/2.0
02:17:16.897137 IP 10.10.10.10.5060 > 10.10.10.20.5062: SIP: SIP/2.0 503 Rate Limit Exceeded
02:17:16.897162 IP 10.10.10.20.5062 > 10.10.10.10.5060: SIP: ACK sip:800@lab.local SIP/2.0
02:17:16.916940 IP 10.10.10.20.5062 > 10.10.10.10.5060: SIP: INVITE sip:800@lab.local SIP/2.0
02:17:16.917074 IP 10.10.10.10.5060 > 10.10.10.20.5062: SIP: SIP/2.0 503 Rate Limit Exceeded
02:17:16.917100 IP 10.10.10.20.5062 > 10.10.10.10.5060: SIP: ACK sip:800@lab.local SIP/2.0
02:17:16.936952 IP 10.10.10.20.5062 > 10.10.10.10.5060: SIP: INVITE sip:800@lab.local SIP/2.0
02:17:16.937093 IP 10.10.10.10.5060 > 10.10.10.20.5062: SIP: SIP/2.0 503 Rate Limit Exceeded
02:17:16.937132 IP 10.10.10.20.5062 > 10.10.10.10.5060: SIP: ACK sip:800@lab.local SIP/2.0
02:17:16.956938 IP 10.10.10.20.5062 > 10.10.10.10.5060: SIP: INVITE sip:800@lab.local SIP/2.0
02:17:16.957050 IP 10.10.10.10.5060 > 10.10.10.20.5062: SIP: SIP/2.0 503 Rate Limit Exceeded
02:17:16.957080 IP 10.10.10.20.5062 > 10.10.10.10.5060: SIP: ACK sip:800@lab.local SIP/2.0
02:17:16.976955 IP 10.10.10.20.5062 > 10.10.10.10.5060: SIP: INVITE sip:800@lab.local SIP/2.0
02:17:16.977143 IP 10.10.10.10.5060 > 10.10.10.20.5062: SIP: SIP/2.0 503 Rate Limit Exceeded
02:17:16.977183 IP 10.10.10.20.5062 > 10.10.10.10.5060: SIP: ACK sip:800@lab.local SIP/2.0
02:17:16.996950 IP 10.10.10.20.5062 > 10.10.10.10.5060: SIP: INVITE sip:800@lab.local SIP/2.0
02:17:16.997109 IP 10.10.10.10.5060 > 10.10.10.20.5062: SIP: SIP/2.0 503 Rate Limit Exceeded
02:17:16.997145 IP 10.10.10.20.5062 > 10.10.10.10.5060: SIP: ACK sip:800@lab.local SIP/2.0
02:17:17.016935 IP 10.10.10.20.5062 > 10.10.10.10.5060: SIP: INVITE sip:800@lab.local SIP/2.0
02:17:17.017280 IP 10.10.10.10.5060 > 10.10.10.20.5062: SIP: SIP/2.0 503 Rate Limit Exceeded
02:17:17.017322 IP 10.10.10.20.5062 > 10.10.10.10.5060: SIP: ACK sip:800@lab.local SIP/2.0
02:17:17.036937 IP 10.10.10.20.5062 > 10.10.10.10.5060: SIP: INVITE sip:800@lab.local SIP/2.0
02:17:17.037050 IP 10.10.10.10.5060 > 10.10.10.20.5062: SIP: SIP/2.0 503 Rate Limit Exceeded
02:17:17.037078 IP 10.10.10.20.5062 > 10.10.10.10.5060: SIP: ACK sip:800@lab.local SIP/2.0
02:17:17.056948 IP 10.10.10.20.5062 > 10.10.10.10.5060: SIP: INVITE sip:800@lab.local SIP/2.0
02:17:17.057078 IP 10.10.10.10.5060 > 10.10.10.20.5062: SIP: SIP/2.0 503 Rate Limit Exceeded
02:17:17.057120 IP 10.10.10.20.5062 > 10.10.10.10.5060: SIP: ACK sip:800@lab.local SIP/2.0
02:17:17.076946 IP 10.10.10.20.5062 > 10.10.10.10.5060: SIP: INVITE sip:800@lab.local SIP/2.0
02:17:17.077124 IP 10.10.10.10.5060 > 10.10.10.20.5062: SIP: SIP/2.0 503 Rate Limit Exceeded
02:17:17.077156 IP 10.10.10.20.5062 > 10.10.10.10.5060: SIP: ACK sip:800@lab.local SIP/2.0
02:17:17.096954 IP 10.10.10.20.5062 > 10.10.10.10.5060: SIP: INVITE sip:800@lab.local SIP/2.0
02:17:17.097131 IP 10.10.10.10.5060 > 10.10.10.20.5062: SIP: SIP/2.0 503 Rate Limit Exceeded
02:17:17.097167 IP 10.10.10.20.5062 > 10.10.10.10.5060: SIP: ACK sip:800@lab.local SIP/2.0
02:17:17.116944 IP 10.10.10.20.5062 > 10.10.10.10.5060: SIP: INVITE sip:800@lab.local SIP/2.0
02:17:17.117132 IP 10.10.10.10.5060 > 10.10.10.20.5062: SIP: SIP/2.0 503 Rate Limit Exceeded
02:17:17.117184 IP 10.10.10.20.5062 > 10.10.10.10.5060: SIP: ACK sip:800@lab.local SIP/2.0
02:17:17.136935 IP 10.10.10.20.5062 > 10.10.10.10.5060: SIP: INVITE sip:800@lab.local SIP/2.0
02:17:17.137060 IP 10.10.10.10.5060 > 10.10.10.20.5062: SIP: SIP/2.0 503 Rate Limit Exceeded
02:17:17.137087 IP 10.10.10.20.5062 > 10.10.10.10.5060: SIP: ACK sip:800@lab.local SIP/2.0
02:17:17.156952 IP 10.10.10.20.5062 > 10.10.10.10.5060: SIP: INVITE sip:800@lab.local SIP/2.0
02:17:17.157090 IP 10.10.10.10.5060 > 10.10.10.20.5062: SIP: SIP/2.0 503 Rate Limit Exceeded
02:17:17.157121 IP 10.10.10.20.5062 > 10.10.10.10.5060: SIP: ACK sip:800@lab.local SIP/2.0
02:17:17.176956 IP 10.10.10.20.5062 > 10.10.10.10.5060: SIP: INVITE sip:800@lab.local SIP/2.0
02:17:17.177087 IP 10.10.10.10.5060 > 10.10.10.20.5062: SIP: SIP/2.0 503 Rate Limit Exceeded
02:17:17.177125 IP 10.10.10.20.5062 > 10.10.10.10.5060: SIP: ACK sip:800@lab.local SIP/2.0
02:17:17.196950 IP 10.10.10.20.5062 > 10.10.10.10.5060: SIP: INVITE sip:800@lab.local SIP/2.0
02:17:17.197068 IP 10.10.10.10.5060 > 10.10.10.20.5062: SIP: SIP/2.0 503 Rate Limit Exceeded
02:17:17.197103 IP 10.10.10.20.5062 > 10.10.10.10.5060: SIP: ACK sip:800@lab.local SIP/2.0
02:17:17.216954 IP 10.10.10.20.5062 > 10.10.10.10.5060: SIP: INVITE sip:800@lab.local SIP/2.0
02:17:17.217071 IP 10.10.10.10.5060 > 10.10.10.20.5062: SIP: SIP/2.0 503 Rate Limit Exceeded
02:17:17.217109 IP 10.10.10.20.5062 > 10.10.10.10.5060: SIP: ACK sip:800@lab.local SIP/2.0
02:17:17.236987 IP 10.10.10.20.5062 > 10.10.10.10.5060: SIP: INVITE sip:800@lab.local SIP/2.0
02:17:17.237204 IP 10.10.10.10.5060 > 10.10.10.20.5062: SIP: SIP/2.0 503 Rate Limit Exceeded
02:17:17.237258 IP 10.10.10.20.5062 > 10.10.10.10.5060: SIP: ACK sip:800@lab.local SIP/2.0
